[
  {
    "id": "G3",
    "family": "glance",
    "name": "Chunky Bars",
    "card_title": "Revenue by plan",
    "card_anchor_id": "c3",
    "data_shape": "small-category ranking comparison (up to 6)",
    "occasion": "weekly report dashboard",
    "reading_speed": "<10s",
    "engine": "Chart.js",
    "gallery_file": "templates/glance-gallery.html",
    "legacy_anchor": null,
    "tier": "primary",
    "siblings": [
      {
        "id": "L2"
      },
      {
        "id": "L15",
        "note": "multi-select percentages"
      }
    ],
    "origin": "upstream"
  },
  {
    "id": "G4",
    "family": "glance",
    "name": "Dot Waffle",
    "card_title": "Where sign-ups come from",
    "card_anchor_id": "waffle",
    "data_shape": "100% composition (share of a whole)",
    "occasion": "general purpose, default replacement for a pie chart",
    "reading_speed": "<10s",
    "engine": "hand-written SVG",
    "gallery_file": "templates/glance-gallery.html",
    "legacy_anchor": null,
    "tier": "primary",
    "siblings": [
      {
        "id": "L14"
      }
    ],
    "origin": "upstream"
  },
  {
    "id": "G5",
    "family": "glance",
    "name": "Pictorial Bar",
    "card_title": "Trees planted, year by year",
    "card_anchor_id": "forest",
    "data_shape": "year-by-year count (one symbol = a fixed quantity)",
    "occasion": "external-facing story page",
    "reading_speed": "<10s",
    "engine": "ECharts",
    "gallery_file": "templates/glance-gallery.html",
    "legacy_anchor": null,
    "tier": "primary",
    "siblings": [],
    "origin": "upstream"
  },
  {
    "id": "G6",
    "family": "glance",
    "name": "Circular Graph (small)",
    "card_title": "Who works with whom",
    "card_anchor_id": "circular",
    "data_shape": "network, up to 12 nodes",
    "occasion": "quick illustration",
    "reading_speed": "<10s",
    "engine": "ECharts (dark card)",
    "gallery_file": "templates/glance-gallery.html",
    "legacy_anchor": null,
    "tier": "primary",
    "siblings": [],
    "origin": "upstream",
    "notes": "Preview version of the big B1 template; use B1 when there are more nodes."
  },
  {
    "id": "G7",
    "family": "glance",
    "name": "Tree LR",
    "card_title": "Everything the platform ships",
    "card_anchor_id": "tree",
    "data_shape": "hierarchy (2-3 levels)",
    "occasion": "product catalog / architecture page",
    "reading_speed": "~30s",
    "engine": "ECharts",
    "gallery_file": "templates/glance-gallery.html",
    "legacy_anchor": null,
    "tier": "primary",
    "siblings": [],
    "origin": "upstream"
  },
  {
    "id": "G8",
    "family": "glance",
    "name": "Rainfall Dual Area",
    "card_title": "Campaigns rain down, sign-ups flow",
    "card_anchor_id": "rainfall",
    "data_shape": "two-series cause and effect (spend vs. output)",
    "occasion": "growth retrospective",
    "reading_speed": "~30s",
    "engine": "ECharts",
    "gallery_file": "templates/glance-gallery.html",
    "legacy_anchor": null,
    "tier": "primary",
    "siblings": [],
    "origin": "upstream"
  },
  {
    "id": "G9",
    "family": "glance",
    "name": "Scatter Morph",
    "card_title": "One dataset, three views",
    "card_anchor_id": "morph",
    "data_shape": "same entity set, three dimensions cycling through",
    "occasion": "short video / live demo",
    "reading_speed": "animated",
    "engine": "ECharts universalTransition",
    "gallery_file": "templates/glance-gallery.html",
    "legacy_anchor": null,
    "tier": "primary",
    "siblings": [],
    "origin": "upstream"
  },
  {
    "id": "G10",
    "family": "glance",
    "name": "Diverging Bar",
    "card_title": "Where we gained, where we bled",
    "card_anchor_id": "negbar",
    "data_shape": "signed (positive/negative) categorical values",
    "occasion": "weekly report dashboard",
    "reading_speed": "<10s",
    "engine": "ECharts",
    "gallery_file": "templates/glance-gallery.html",
    "legacy_anchor": null,
    "tier": "primary",
    "siblings": [],
    "origin": "upstream",
    "notes": "Equalizer and Meridian Dots were removed from the catalog; this is the surviving signed-value chart."
  },
  {
    "id": "G11",
    "family": "glance",
    "name": "Force Graph (small)",
    "card_title": "Integrations, pulled into orbit",
    "card_anchor_id": "force",
    "data_shape": "hub-and-satellite network, up to 15 nodes",
    "occasion": "quick illustration, draggable",
    "reading_speed": "<10s",
    "engine": "ECharts (dark card)",
    "gallery_file": "templates/glance-gallery.html",
    "legacy_anchor": null,
    "tier": "primary",
    "siblings": [
      {
        "id": "L6",
        "note": "static poster version"
      }
    ],
    "origin": "upstream",
    "notes": "Preview version of the big B2 template."
  },
  {
    "id": "G12",
    "family": "glance",
    "name": "Stagger Wave",
    "card_title": "Fifty markets, one wave",
    "card_anchor_id": "wave",
    "data_shape": "multi-category distribution (30-60 bars)",
    "occasion": "short-video entrance",
    "reading_speed": "animated",
    "engine": "ECharts",
    "gallery_file": "templates/glance-gallery.html",
    "legacy_anchor": null,
    "tier": "primary",
    "siblings": [],
    "origin": "upstream"
  },
  {
    "id": "G13",
    "family": "glance",
    "name": "Big Slice (Custom Pie)",
    "card_title": "Big slice, deep engagement",
    "card_anchor_id": "custompie",
    "data_shape": "double encoding: share of whole (angle) x intensity (radius)",
    "occasion": "product analysis",
    "reading_speed": "~30s",
    "engine": "ECharts custom series",
    "gallery_file": "templates/glance-gallery.html",
    "legacy_anchor": null,
    "tier": "primary",
    "siblings": [],
    "origin": "upstream"
  },
  {
    "id": "G14",
    "family": "glance",
    "name": "Single Axis",
    "card_title": "Support load, day by day",
    "card_anchor_id": "singleaxis",
    "data_shape": "weekday x hour x volume (punch-card data)",
    "occasion": "support/ops weekly report",
    "reading_speed": "~30s",
    "engine": "ECharts",
    "gallery_file": "templates/glance-gallery.html",
    "legacy_anchor": null,
    "tier": "primary",
    "siblings": [],
    "origin": "upstream",
    "notes": "Punch Card was removed from the catalog; this is the sole surviving version of that data shape."
  },
  {
    "id": "G15",
    "family": "glance",
    "name": "Jitter Strip",
    "card_title": "Response times, spread out",
    "card_anchor_id": "jitter",
    "data_shape": "grouped distribution, record-by-record (a few hundred points)",
    "occasion": "SRE / ticket analysis",
    "reading_speed": "~30s",
    "engine": "ECharts",
    "gallery_file": "templates/glance-gallery.html",
    "legacy_anchor": null,
    "tier": "primary",
    "siblings": [],
    "origin": "upstream"
  },
  {
    "id": "G16",
    "family": "glance",
    "name": "Bar Race",
    "card_title": "Eight products race for revenue",
    "card_anchor_id": "race",
    "data_shape": "ranking evolving over time",
    "occasion": "short video",
    "reading_speed": "animated",
    "engine": "ECharts realtimeSort",
    "gallery_file": "templates/glance-gallery.html",
    "legacy_anchor": null,
    "tier": "primary",
    "siblings": [],
    "origin": "upstream"
  },
  {
    "id": "G17",
    "family": "glance",
    "name": "Dynamic Stream",
    "card_title": "Concurrent users, streaming",
    "card_anchor_id": "stream",
    "data_shape": "real-time scrolling series",
    "occasion": "livestream / big screen",
    "reading_speed": "animated",
    "engine": "ECharts",
    "gallery_file": "templates/glance-gallery.html",
    "legacy_anchor": null,
    "tier": "primary",
    "siblings": [],
    "origin": "upstream"
  },
  {
    "id": "G18",
    "family": "glance",
    "name": "Draw-in + Counter",
    "card_title": "H1 revenue, drawn in one stroke",
    "card_anchor_id": "stroke",
    "data_shape": "cumulative growth (one line + one big number)",
    "occasion": "short video / presentation opener",
    "reading_speed": "animated",
    "engine": "ECharts",
    "gallery_file": "templates/glance-gallery.html",
    "legacy_anchor": null,
    "tier": "primary",
    "siblings": [],
    "origin": "upstream",
    "notes": "Release Rings was removed from the catalog."
  },
  {
    "id": "G19",
    "family": "glance",
    "name": "Violin",
    "card_title": "How fast each plan gets an answer",
    "card_anchor_id": "violin",
    "data_shape": "grouped continuous-distribution density outline + median",
    "occasion": "dashboard / analysis readout",
    "reading_speed": "<10s",
    "engine": "SVG",
    "gallery_file": "templates/glance-gallery.html",
    "legacy_anchor": null,
    "tier": "backup",
    "siblings": [
      {
        "id": "F15"
      },
      {
        "id": "L19"
      }
    ],
    "origin": "upstream"
  },
  {
    "id": "G20",
    "family": "glance",
    "name": "Matrix Heat (Glance)",
    "card_title": "Adoption runs hot on the new versions",
    "card_anchor_id": "gheat",
    "data_shape": "two discrete dimensions x value, up to 60 cells, each cell read directly",
    "occasion": "dashboard / product analysis",
    "reading_speed": "<10s",
    "engine": "SVG",
    "gallery_file": "templates/glance-gallery.html",
    "legacy_anchor": null,
    "tier": "backup",
    "siblings": [
      {
        "id": "L16",
        "note": "close-read version"
      }
    ],
    "origin": "upstream"
  },
  {
    "id": "G21",
    "family": "glance",
    "name": "Rank Strip",
    "card_title": "Flows climbs to the top",
    "card_anchor_id": "rankstrip",
    "data_shape": "multi-entity ranking over discrete time, print-friendly",
    "occasion": "reporting / billing retrospective",
    "reading_speed": "<10s",
    "engine": "SVG",
    "gallery_file": "templates/glance-gallery.html",
    "legacy_anchor": null,
    "tier": "backup",
    "siblings": [
      {
        "id": "G16",
        "note": "animated presentation version"
      }
    ],